{
  "catalog_version": 1,
  "last_verified": "2026-08-26T00:00:00Z",
  "sources": [
    "https://github.com/Andyyyy64/whichllm",
    "https://omniroute.dev",
    "Manual provider research"
  ],
  "scoring_weights": {
    "quota_value": 15,
    "usefulness": 15,
    "downstream_capabilities": 30,
    "compatibility": 15,
    "account_freshness": 5,
    "registration_cost": -10,
    "verification_cost": -5,
    "policy_risk": -10
  },
  "providers": [
    {
      "id": "codex",
      "name": "OpenAI Codex",
      "category": "llm",
      "auth_type": "oauth",
      "signup_url": "https://platform.openai.com/signup",
      "login_url": "https://platform.openai.com/login",
      "dashboard_url": "https://platform.openai.com/settings/organization/api-keys",
      "free_tier": {
        "enabled": true,
        "quota": "$10-20 credit for new accounts (region-dependent)",
        "type": "sign_up_credit"
      },
      "identity_requirements": [
        "email"
      ],
      "identity_relationships": [
        "google",
        "github"
      ],
      "omniroute_support": {
        "supported": true,
        "type": "direct",
        "notes": "OAuth connector"
      },
      "policy": {
        "multiple_accounts": "restricted",
        "duplicate_account_policy": "restricted",
        "automation_allowed": "disallowed",
        "third_party_proxy_allowed": "disallowed",
        "phone_reuse_allowed": "disallowed"
      },
      "signup_difficulty": "moderate",
      "verification_requirements": [
        "email",
        "phone"
      ],
      "tos_notes": {
        "personal_use_only": false,
        "proxy_clause": true,
        "multi_account_clause": true,
        "notes": "OpenAI ToS restricts sharing API keys and automated account creation"
      },
      "upstream_identity": null,
      "downstream_identities": [],
      "cascades_to": [],
      "tier_value": 65,
      "usefulness": 85,
      "compatibility": 95,
      "metadata": {}
    },
    {
      "id": "claude",
      "name": "Anthropic Claude",
      "category": "llm",
      "auth_type": "oauth",
      "signup_url": "https://claude.ai/signup",
      "login_url": "https://claude.ai/login",
      "dashboard_url": "https://claude.ai/settings",
      "free_tier": {
        "enabled": true,
        "quota": "20 req/day Claude 4 Sonnet",
        "type": "daily"
      },
      "identity_requirements": [
        "email"
      ],
      "identity_relationships": [],
      "omniroute_support": {
        "supported": true,
        "type": "direct",
        "notes": "OAuth connector via Claude Code"
      },
      "policy": {
        "multiple_accounts": "unknown",
        "duplicate_account_policy": "unknown",
        "automation_allowed": "unknown",
        "third_party_proxy_allowed": "unknown",
        "phone_reuse_allowed": "unknown"
      },
      "signup_difficulty": "moderate",
      "verification_requirements": [
        "email"
      ],
      "tos_notes": {
        "personal_use_only": false,
        "proxy_clause": true,
        "multi_account_clause": false
      },
      "upstream_identity": null,
      "downstream_identities": [],
      "cascades_to": [],
      "tier_value": 50,
      "usefulness": 70,
      "compatibility": 90,
      "metadata": {}
    },
    {
      "id": "cline",
      "name": "Cline",
      "category": "tool_platform",
      "auth_type": "oauth",
      "signup_url": "https://cline.rodney.fm",
      "login_url": "https://cline.rodney.fm/login",
      "dashboard_url": "",
      "free_tier": {
        "enabled": true,
        "quota": "Free for open-source & commercial use",
        "type": "uncapped"
      },
      "identity_requirements": [
        "email",
        "github"
      ],
      "identity_relationships": [
        "google",
        "github"
      ],
      "omniroute_support": {
        "supported": true,
        "type": "direct"
      },
      "policy": {
        "multiple_accounts": "allowed",
        "duplicate_account_policy": "allowed",
        "automation_allowed": "allowed",
        "third_party_proxy_allowed": "allowed",
        "phone_reuse_allowed": "allowed"
      },
      "signup_difficulty": "easy",
      "verification_requirements": [],
      "tos_notes": {
        "personal_use_only": false,
        "proxy_clause": false,
        "multi_account_clause": false
      },
      "upstream_identity": null,
      "downstream_identities": [],
      "cascades_to": [],
      "tier_value": 20,
      "usefulness": 40,
      "compatibility": 95,
      "metadata": {}
    },
    {
      "id": "cursor",
      "name": "Cursor",
      "category": "tool_platform",
      "auth_type": "oauth",
      "signup_url": "https://cursor.sh",
      "login_url": "https://cursor.sh/login",
      "dashboard_url": "",
      "free_tier": {
        "enabled": true,
        "quota": "Free tier with limited usage",
        "type": "daily"
      },
      "identity_requirements": [
        "email",
        "github"
      ],
      "identity_relationships": [
        "google",
        "github"
      ],
      "omniroute_support": {
        "supported": true,
        "type": "direct"
      },
      "policy": {
        "multiple_accounts": "restricted",
        "duplicate_account_policy": "restricted",
        "automation_allowed": "disallowed",
        "third_party_proxy_allowed": "unknown",
        "phone_reuse_allowed": "unknown"
      },
      "signup_difficulty": "easy",
      "verification_requirements": [
        "email"
      ],
      "tos_notes": {
        "personal_use_only": true,
        "proxy_clause": true,
        "multi_account_clause": true,
        "notes": "Pro-only for business use"
      },
      "upstream_identity": null,
      "downstream_identities": [],
      "cascades_to": [],
      "tier_value": 30,
      "usefulness": 60,
      "compatibility": 95,
      "metadata": {}
    },
    {
      "id": "kilocode",
      "name": "KiloCode",
      "category": "tool_platform",
      "auth_type": "oauth",
      "signup_url": "https://kilocode.com",
      "login_url": "https://kilocode.com/login",
      "dashboard_url": "",
      "free_tier": {
        "enabled": true,
        "quota": "Free tier",
        "type": "uncapped"
      },
      "identity_requirements": [
        "email",
        "github"
      ],
      "identity_relationships": [],
      "omniroute_support": {
        "supported": true,
        "type": "direct"
      },
      "policy": {
        "multiple_accounts": "allowed",
        "duplicate_account_policy": "allowed",
        "automation_allowed": "allowed",
        "third_party_proxy_allowed": "allowed",
        "phone_reuse_allowed": "allowed"
      },
      "signup_difficulty": "easy",
      "verification_requirements": [],
      "tos_notes": {
        "personal_use_only": false,
        "proxy_clause": false,
        "multi_account_clause": false
      },
      "upstream_identity": null,
      "downstream_identities": [],
      "cascades_to": [],
      "tier_value": 20,
      "usefulness": 35,
      "compatibility": 90,
      "metadata": {}
    },
    {
      "id": "grokcli",
      "name": "Grok CLI",
      "category": "llm",
      "auth_type": "oauth",
      "signup_url": "https://x.ai",
      "login_url": "https://x.ai/login",
      "dashboard_url": "",
      "free_tier": {
        "enabled": true,
        "quota": "Limited free usage",
        "type": "daily"
      },
      "identity_requirements": [
        "email",
        "phone"
      ],
      "identity_relationships": [],
      "omniroute_support": {
        "supported": true,
        "type": "direct"
      },
      "policy": {
        "multiple_accounts": "unknown",
        "duplicate_account_policy": "unknown",
        "automation_allowed": "unknown",
        "third_party_proxy_allowed": "unknown",
        "phone_reuse_allowed": "unknown"
      },
      "signup_difficulty": "hard",
      "verification_requirements": [
        "email",
        "phone"
      ],
      "tos_notes": {
        "personal_use_only": true,
        "proxy_clause": true,
        "multi_account_clause": true,
        "notes": "Requires X/Twitter account verification"
      },
      "upstream_identity": null,
      "downstream_identities": [],
      "cascades_to": [],
      "tier_value": 40,
      "usefulness": 60,
      "compatibility": 75,
      "metadata": {}
    },
    {
      "id": "antigravity",
      "name": "Antigravity",
      "category": "tool_platform",
      "auth_type": "oauth",
      "signup_url": "https://antigravity.ai",
      "login_url": "https://antigravity.ai/login",
      "dashboard_url": "",
      "free_tier": {
        "enabled": true,
        "quota": "Free tier with agent access",
        "type": "uncapped"
      },
      "identity_requirements": [
        "email",
        "google",
        "github"
      ],
      "identity_relationships": [
        "google",
        "github"
      ],
      "omniroute_support": {
        "supported": true,
        "type": "direct"
      },
      "policy": {
        "multiple_accounts": "allowed",
        "duplicate_account_policy": "allowed",
        "automation_allowed": "allowed",
        "third_party_proxy_allowed": "allowed",
        "phone_reuse_allowed": "allowed"
      },
      "signup_difficulty": "easy",
      "verification_requirements": [],
      "tos_notes": {
        "personal_use_only": false,
        "proxy_clause": false,
        "multi_account_clause": false
      },
      "upstream_identity": null,
      "downstream_identities": [],
      "cascades_to": [],
      "tier_value": 30,
      "usefulness": 70,
      "compatibility": 95,
      "metadata": {}
    },
    {
      "id": "kiro",
      "name": "Amazon Kiro",
      "category": "llm",
      "auth_type": "oauth",
      "signup_url": "https://kiro.dev",
      "login_url": "https://kiro.dev/login",
      "dashboard_url": "",
      "free_tier": {
        "enabled": true,
        "quota": "50 credits/month",
        "type": "monthly"
      },